{
  "$schema": "specs/contracts/agent_catalog.schema.json",
  "contract_version": "kill-life-agent-catalog/v1",
  "updated_at": "2026-03-29",
  "repo": "Kill_LIFE",
  "agents": [
    {
      "id": "PM-Mesh",
      "slug": "pm_mesh",
      "display_name": "PM Mesh",
      "purpose": "Pilot intake, planning, prioritization, and mesh governance handoffs.",
      "owner_repo": "Kill_LIFE",
      "agent_doc": "agents/pm_mesh.md",
      "github_agent_doc": ".github/agents/pm_mesh.md",
      "start_prompt": ".github/prompts/start_pm_mesh.prompt.md",
      "plan_wizard_prompt": ".github/prompts/plan_wizard_pm_mesh.prompt.md",
      "write_set_roots": [
        "specs/",
        "docs/plans/",
        ".github/prompts/"
      ],
      "rituals": [
        "bmad/rituals/kickoff.md"
      ],
      "gates": [
        "bmad/gates/gate_s0.md"
      ],
      "handoff_contracts": [
        "specs/contracts/agent_handoff.schema.json",
        "specs/contracts/summary_short.schema.json"
      ],
      "evidence_paths": [
        "docs/plans/",
        "artifacts/cockpit/intelligence_program/"
      ],
      "subagents": [
        {
          "id": "Plan-Orchestrator",
          "purpose": "Sequence lots and canonical plans."
        },
        {
          "id": "Intake-Guard",
          "purpose": "Triage intake and capture goals."
        },
        {
          "id": "Todo-Tracker",
          "purpose": "Maintain execution-ready task lists."
        }
      ],
      "public_api_enabled": true
    },
    {
      "id": "Arch-Mesh",
      "slug": "arch_mesh",
      "display_name": "Arch Mesh",
      "purpose": "Own architecture, ADRs, and cross-surface contract design.",
      "owner_repo": "Kill_LIFE",
      "agent_doc": "agents/arch_mesh.md",
      "github_agent_doc": ".github/agents/arch_mesh.md",
      "start_prompt": ".github/prompts/start_arch_mesh.prompt.md",
      "plan_wizard_prompt": ".github/prompts/plan_wizard_arch_mesh.prompt.md",
      "write_set_roots": [
        "specs/",
        "docs/",
        "kill_life/"
      ],
      "rituals": [
        "bmad/rituals/kickoff.md"
      ],
      "gates": [
        "bmad/gates/gate_s0.md"
      ],
      "handoff_contracts": [
        "specs/contracts/agent_handoff.schema.json"
      ],
      "evidence_paths": [
        "artifacts/arch/",
        "docs/"
      ],
      "subagents": [
        {
          "id": "Contract-Guard",
          "purpose": "Keep public interfaces versioned and coherent."
        },
        {
          "id": "Mesh-Contracts",
          "purpose": "Align tri-repo contract boundaries."
        }
      ],
      "public_api_enabled": true
    },
    {
      "id": "Docs-Research",
      "slug": "docs_research",
      "display_name": "Docs Research",
      "purpose": "Maintain canonical documentation, navigation, research summaries, and the agent catalog narrative.",
      "owner_repo": "Kill_LIFE",
      "agent_doc": "agents/docs_research.md",
      "github_agent_doc": ".github/agents/docs_research.md",
      "start_prompt": ".github/prompts/start_docs_research.prompt.md",
      "plan_wizard_prompt": ".github/prompts/plan_wizard_docs_research.prompt.md",
      "write_set_roots": [
        "docs/",
        "README.md",
        "README_FR.md",
        "agents/",
        ".github/agents/"
      ],
      "rituals": [
        "bmad/rituals/kickoff.md"
      ],
      "gates": [
        "bmad/gates/gate_s0.md"
      ],
      "handoff_contracts": [
        "specs/contracts/agent_handoff.schema.json"
      ],
      "evidence_paths": [
        "docs/",
        "artifacts/cockpit/"
      ],
      "subagents": [
        {
          "id": "Doc-Entry",
          "purpose": "Maintain canonical entry points and onboarding."
        },
        {
          "id": "Plan-Recorder",
          "purpose": "Capture plan memory and governance deltas."
        },
        {
          "id": "Agent-Catalog",
          "purpose": "Own agent-facing docs and references."
        }
      ],
      "public_api_enabled": true
    },
    {
      "id": "Runtime-Companion",
      "slug": "runtime_companion",
      "display_name": "Runtime Companion",
      "purpose": "Own runtime AI, MCP alignment, provider bridges, and degraded-safe execution surfaces.",
      "owner_repo": "Kill_LIFE",
      "agent_doc": "agents/runtime_companion.md",
      "github_agent_doc": ".github/agents/runtime_companion.md",
      "start_prompt": ".github/prompts/start_runtime_companion.prompt.md",
      "plan_wizard_prompt": ".github/prompts/plan_wizard_runtime_companion.prompt.md",
      "write_set_roots": [
        "tools/ai/",
        "tools/ops/",
        "mcp.json",
        "specs/mcp_agentics_target_backlog.md"
      ],
      "rituals": [
        "bmad/rituals/kickoff.md"
      ],
      "gates": [
        "bmad/gates/gate_s0.md"
      ],
      "handoff_contracts": [
        "specs/contracts/agent_handoff.schema.json",
        "specs/contracts/runtime_mcp_ia_gateway.schema.json"
      ],
      "evidence_paths": [
        "artifacts/cockpit/runtime_ai_gateway/",
        "artifacts/ops/"
      ],
      "subagents": [
        {
          "id": "MCP-Health",
          "purpose": "Maintain runtime and MCP summary surfaces."
        },
        {
          "id": "Provider-Bridge",
          "purpose": "Stabilize provider routing and live smokes."
        },
        {
          "id": "Runtime-Guard",
          "purpose": "Track runtime health and recovery paths."
        }
      ],
      "public_api_enabled": true
    },
    {
      "id": "QA-Compliance",
      "slug": "qa_compliance",
      "display_name": "QA Compliance",
      "purpose": "Own tests, compliance gates, schema checks, and release-ready evidence.",
      "owner_repo": "Kill_LIFE",
      "agent_doc": "agents/qa_compliance.md",
      "github_agent_doc": ".github/agents/qa_compliance.md",
      "start_prompt": ".github/prompts/start_qa_compliance.prompt.md",
      "plan_wizard_prompt": ".github/prompts/plan_wizard_qa_compliance.prompt.md",
      "write_set_roots": [
        "test/",
        "compliance/",
        ".github/workflows/",
        "tools/specs/"
      ],
      "rituals": [
        "bmad/rituals/kickoff.md"
      ],
      "gates": [
        "bmad/gates/gate_s0.md",
        "bmad/gates/gate_s1.md"
      ],
      "handoff_contracts": [
        "specs/contracts/operator_lane_evidence.schema.json"
      ],
      "evidence_paths": [
        "docs/evidence/",
        "compliance/evidence/",
        "artifacts/ci/"
      ],
      "subagents": [
        {
          "id": "Constraint-Gate",
          "purpose": "Enforce invariants and compliance rules."
        },
        {
          "id": "Contract-Tests",
          "purpose": "Keep JSON and CLI contracts stable."
        },
        {
          "id": "Release-Gates",
          "purpose": "Guard CI, build, and release checks."
        }
      ],
      "public_api_enabled": true
    },
    {
      "id": "Embedded-CAD",
      "slug": "embedded_cad",
      "display_name": "Embedded CAD",
      "purpose": "Own KiCad, FreeCAD, OpenSCAD, hardware assets, and fabrication-facing CAD lanes.",
      "owner_repo": "Kill_LIFE",
      "agent_doc": "agents/embedded_cad.md",
      "github_agent_doc": ".github/agents/embedded_cad.md",
      "start_prompt": ".github/prompts/start_embedded_cad.prompt.md",
      "plan_wizard_prompt": ".github/prompts/plan_wizard_embedded_cad.prompt.md",
      "write_set_roots": [
        "tools/cad/",
        "tools/hw/",
        "hardware/",
        "specs/kicad_mcp_scope_spec.md"
      ],
      "rituals": [
        "bmad/rituals/kickoff.md"
      ],
      "gates": [
        "bmad/gates/gate_s0.md",
        "bmad/gates/gate_s1.md"
      ],
      "handoff_contracts": [
        "specs/contracts/agent_handoff.schema.json",
        "specs/contracts/fab_package.schema.json"
      ],
      "evidence_paths": [
        "artifacts/cad-fusion/",
        "artifacts/cad-ai-native/",
        "docs/evidence/"
      ],
      "subagents": [
        {
          "id": "CAD-Bridge",
          "purpose": "Bridge KiCad, FreeCAD, and MCP lanes."
        },
        {
          "id": "HW-BOM",
          "purpose": "Own fabrication and BOM-oriented outputs."
        },
        {
          "id": "CAD-Fusion",
          "purpose": "Run the YiACAD AI-native fusion lot."
        }
      ],
      "public_api_enabled": true
    },
    {
      "id": "Web-CAD-Platform",
      "slug": "web_cad_platform",
      "display_name": "Web CAD Platform",
      "purpose": "Own the YiACAD web product, project read models, queue/workers, realtime, and review surfaces.",
      "owner_repo": "Kill_LIFE",
      "agent_doc": "agents/web_cad_platform.md",
      "github_agent_doc": ".github/agents/web_cad_platform.md",
      "start_prompt": ".github/prompts/start_web_cad_platform.prompt.md",
      "plan_wizard_prompt": ".github/prompts/plan_wizard_web_cad_platform.prompt.md",
      "write_set_roots": [
        "web/app/",
        "web/components/",
        "web/lib/",
        "web/realtime/",
        "web/workers/"
      ],
      "rituals": [
        "bmad/rituals/kickoff.md"
      ],
      "gates": [
        "bmad/gates/gate_s0.md"
      ],
      "handoff_contracts": [
        "specs/contracts/summary_short.schema.json",
        "specs/contracts/yiacad_uiux_output.schema.json"
      ],
      "evidence_paths": [
        "web/project/.ci/",
        "artifacts/cockpit/intelligence_program/"
      ],
      "subagents": [
        {
          "id": "Project-Service",
          "purpose": "Own GraphQL and project metadata."
        },
        {
          "id": "EDA-CI-Orchestrator",
          "purpose": "Own queue, workers, and EDA job orchestration."
        },
        {
          "id": "Realtime-Collab",
          "purpose": "Own Yjs transport and persistence."
        }
      ],
      "public_api_enabled": true
    },
    {
      "id": "UX-Lead",
      "slug": "ux_lead",
      "display_name": "UX Lead",